{"format":"remember-message","version":1,"type":"event","request_id":"01a14521-0c00-7000-8000-0000000000f1",
 "data":{"event_id":"01a14521-0c00-7c11-9a00-0000000000e2","event_type":"memory.updated","occurred_at":"2026-10-16T14:21:09.004Z","detected_at":"2026-10-16T14:21:09.004Z","batch_id":null,
  "cause":{"command":"update","origin":"local","hook":"plugin/router/run","run_id":"01a14521-0bf0-7000-8000-0000000000c1","depth":1,
   "chain":[{"hook":"plugin/router/run","event_id":"01a14521-0a00-7c11-9a00-0000000000e1","memory_id":"01a14521-09ff-7d20-8c00-00000000aa01","depth":1}]},
  "brain":{"path":"~/.remember/remember.db","device_id":"01a0d90a-e71c-7a0a-bb2c-3b377482fa51"},
  "memory":{"id":"01a14521-09ff-7d20-8c00-00000000aa01","key":null,"body":"Read later: https://sqlite.org/fts5.html#the_bm25_function (expanded)","tags":["reading","to:reviewer"],"created_at":"2026-10-16T14:21:03.512Z","updated_at":"2026-10-16T14:21:09.004Z","expires_at":null,"deleted_at":null,"bin":"live","change_seq":118,"created_by":{"kind":"human","id":null},"updated_by":{"kind":"agent","id":null},"links":[]},
  "changes":{"fields":["tags"],"before":{"tags":["reading"]},"tags_added":["to:reviewer"],"tags_removed":[]},
  "truncated":false,"truncated_fields":[],"limits":{"max_bytes":262144},
  "plugin":{"name":"router","plugin_version":"0.1.0"},"entry":"run","data_dir":"/Users/itay/.remember/remember.db.d/plugins/router/data/","settings":[{"key":"plugin.router.enabled","value":true}]}}
