{"format":"remember-message","version":1,"type":"filter.search.results.result","request_id":"01a14523-0000-7000-8000-000000000201",
 "data":{"results":[
   {"memory_id":"01a13c55-3b21-7a0e-9f11-aa00bb11cc22","score":0.91},
   {"memory_id":"01a13a8c-55f0-7c2e-9b1d-4e0c7f3a2b11","score":0.87},
   {"memory_id":"01a13d10-0000-7abc-8def-0123456789ab","score":0.80}],
  "additions":["01a13d10-0000-7abc-8def-0123456789ab"],
  "note":"hybrid: 92% indexed, model small"}}
