{"format":"remember-message","version":1,"type":"event.result","request_id":"01a14521-0b00-7000-8000-0000000000ea","error":{"code":"fetch_failed","message":"The page https://sqlite.org/fts5.html did not answer in 10s.","fix":"Check the network, then run 'remember plugin log url_expand'.","retryable":true}}
