{"format":"remember-message","version":1,"type":"memory.search.result",
 "data":{"count":1,"total":1,"keys":[],"tags":[],
  "entries":[{"id":"01a13a8c-55f0-7c2e-9b1d-4e0c7f3a2b11","local_id":41,"key":null,"body":"Please review PR #88 (export path escaping).","tags":["to:reviewer"],"created_at":"2026-10-14T12:00:00.000Z","updated_at":"2026-10-14T12:30:00.000Z","expires_at":null,"deleted_at":null,"bin":"live","version_vector":{"01a13651-e244-717d-bd40-7850d5e2f27d":2},"links":[]}],
  "query":{
   "original":{"text":"export paths","tags":[],"bins":["live"],"time_range":{"field":"updated_at","after":null,"before":null}},
   "rewritten":{"text":"export paths","tags":[],"bins":["live"],"time_range":{"field":"updated_at","after":null,"before":null}}},
  "ranked_by":"bm25",
  "filters":[
   {"name":"hybrid/rerank","plugin_version":"1.0.0","point":"search.results","status":"timeout","reason":"cold_grace","duration_ms":1500,"cold":true}]},
 "warnings":[
  {"code":"plugin_filter_cold_start","message":"Filter hybrid/rerank is still starting, so these results are in keyword (BM25) order. It keeps loading, and a later search will use it.","detail":{"plugin":"hybrid","filter":"rerank","reason":"cold_grace","waited_ms":1500}}]}
